stop_u,stop_v,max_c_weekday,min_c_weekday,max_c_weekend,min_c_weekend
"Tsun Wen Road,  Outside Hing Wai House,  Tai Hing Estate","Tin King Road,  Leung King Bus Terminus",76.0,57.0,76.0,57.0
"Tin King Road,  Leung King Bus Terminus","Ming Kum Road,  opposite Shek Pai Light Rail Station",76.0,57.0,76.0,57.0
"Ming Kum Road,  opposite Shek Pai Light Rail Station","Lung Mun Road,  outside Glorious Garden",76.0,57.0,76.0,57.0
"Lee On Road,  Outside Lee Ming House,  Shun Lee Estate","Shun King Road,  Shun Lee Shopping Centre (Phase II)",570.0,285.0,570.0,285.0
"Shun King Road,  Shun Lee Shopping Centre (Phase II)","Lee On Road,  Opposite On Yat House,  Shun On Estate",570.0,285.0,570.0,285.0
"Sau Mau Ping Road,  Opposite Ning Po No.2 College","Chun Wah Road,  Outside Lok Sin Tong Yeung Chung Ming Primary School",570.0,285.0,570.0,285.0
"Chun Wah Road,  Outside Lok Sin Tong Yeung Chung Ming Primary School","Chun Wah Road,  Outside Lok Wah Estate Community Centre",570.0,285.0,570.0,285.0
"Chun Wah Road,  Outside Lok Wah Estate Community Centre","Chun Wah Road,  Outside Nga Yee House,  Lok Nga Court",570.0,285.0,570.0,285.0
"Chun Wah Road,  Outside Nga Yee House,  Lok Nga Court","Chun Wah Road,  Outside Kay Yue House,  On Kay Court",570.0,285.0,570.0,285.0
"Chun Wah Road,  Outside Kay Yue House,  On Kay Court",The bus stop on Ngau Tau Kok Road westbound near Ngau Tau Kok Fourth Street,570.0,285.0,570.0,285.0
The bus stop on Ngau Tau Kok Road westbound near Ngau Tau Kok Fourth Street,"Ngau Tau Kok Road,  Opposite Lee Kee Building",570.0,285.0,570.0,285.0
"Ngau Tau Kok Road,  Opposite Lee Kee Building","Kai Cheung Road,  Outside Kadar Building",570.0,285.0,570.0,285.0
"Kai Cheung Road,  Outside Kadar Building",The bus layby on Kai Cheung Road westbound outside Dai Cheong Car Service Centre Building,570.0,285.0,570.0,285.0
The bus layby on Kai Cheung Road westbound outside Dai Cheong Car Service Centre Building,Lam Wah Street,570.0,285.0,570.0,285.0
Lam Wah Street,"Lam Fung Street,  opposite Mega Box",285.0,142.5,285.0,142.5
"Lam Fung Street,  opposite Mega Box","Wang Chiu Road,  Outside Proficient Industrial Centre",285.0,142.5,285.0,142.5
"Wang Chiu Road,  Outside Proficient Industrial Centre","Chun Wah Road,  Outside Jordan Valley Factory Estate",570.0,285.0,570.0,285.0
"Chun Wah Road,  Outside Jordan Valley Factory Estate","Sheung Yuet Road,  Outside Enterprise Building",285.0,142.5,285.0,142.5
"Sheung Yuet Road,  Outside Enterprise Building","Chun Wah Road,  Opposite Nga Yee House,  Lok Nga Court",285.0,142.5,285.0,142.5
"Chun Wah Road,  Opposite Nga Yee House,  Lok Nga Court",The front portion of the PLB (Scheduled) Service Stand at Kowloon Bay Public Transport Terminus,285.0,142.5,285.0,142.5
The front portion of the PLB (Scheduled) Service Stand at Kowloon Bay Public Transport Terminus,"Chun Wah Road,  Opposite Lok Wah Estate Community Centre",285.0,142.5,285.0,142.5
"Chun Wah Road,  Opposite Lok Wah Estate Community Centre","Sheung Yuet Road,  Outside Enterprise Building",285.0,142.5,285.0,142.5
"Sheung Yuet Road,  Outside Enterprise Building","Hong Ning Road,  Opposite Sau Mau Ping District Police Headquarter And Divisional Police Station",285.0,142.5,285.0,142.5
"Hong Ning Road,  Opposite Sau Mau Ping District Police Headquarter And Divisional Police Station",The layby inside Mega Box,285.0,142.5,285.0,142.5
The layby inside Mega Box,"Shun On Road,  Outisde Ning Po No.2 College",285.0,142.5,285.0,142.5
"Shun On Road,  Outisde Ning Po No.2 College","Wang Chiu Road,  Outside Proficient Industrial Centre",285.0,142.5,285.0,142.5
"Wang Chiu Road,  Outside Proficient Industrial Centre","Lee On Road,  Outside Lee Ming House,  Shun Lee Estate",285.0,142.5,285.0,142.5
"Lee On Road,  Outside Lee Ming House,  Shun Lee Estate","Chun Wah Road,  Outside Jordan Valley Factory Estate",285.0,142.5,285.0,142.5
"Chun Wah Road,  Outside Jordan Valley Factory Estate","Chun Wah Road,  Opposite Nga Yee House,  Lok Nga Court",570.0,285.0,570.0,285.0
"Chun Wah Road,  Opposite Nga Yee House,  Lok Nga Court","Chun Wah Road,  Opposite Lok Wah Estate Community Centre",722.0,399.0,722.0,399.0
"Chun Wah Road,  Opposite Lok Wah Estate Community Centre","Hong Ning Road,  Opposite Sau Mau Ping District Police Headquarter And Divisional Police Station",570.0,285.0,570.0,285.0
"Hong Ning Road,  Opposite Sau Mau Ping District Police Headquarter And Divisional Police Station","Shun On Road,  Outisde Ning Po No.2 College",570.0,285.0,570.0,285.0
"Shun On Road,  Outisde Ning Po No.2 College","Lee On Road,  Outside Lee Ming House,  Shun Lee Estate",570.0,285.0,570.0,285.0
Lam Wah Street,The front portion of the PLB (Scheduled) Service Stand at Kowloon Bay Public Transport Terminus,285.0,142.5,285.0,142.5
The front portion of the PLB (Scheduled) Service Stand at Kowloon Bay Public Transport Terminus,"Sheung Yuet Road,  Outside Enterprise Building",285.0,142.5,285.0,142.5
"Sheung Yuet Road,  Outside Enterprise Building","Wang Chiu Road,  Outside Proficient Industrial Centre",285.0,142.5,285.0,142.5
Shan Mei Street Bus Terminus,"Fo Tan Road Southbound,  Near Lok King Street",190.0,76.0,142.5,76.0
"Fo Tan Road Southbound,  Near Lok King Street",Sai Lau Kok Road - layby opposite Tsuen Wan Station Multi-storey Carpark Building,190.0,76.0,142.5,76.0
Sai Lau Kok Road - layby opposite Tsuen Wan Station Multi-storey Carpark Building,"Tsuen Wan Market Street,  Outside Tsuen Wan Market",190.0,76.0,142.5,76.0
"Tsuen Wan Market Street,  Outside Tsuen Wan Market","Fo Tan Road Northbound,  Near Fo Tan Tsuen",190.0,76.0,142.5,76.0
"Fo Tan Road Northbound,  Near Fo Tan Tsuen",Shan Mei Street Bus Terminus,190.0,76.0,142.5,76.0
"Tsuen Wan Market Street,  Outside Tsuen Wan Market","Yuen Tun Circuit,  Outside Tsuen Wan Town Hall",152.0,95.0,152.0,83.6
"Yuen Tun Circuit,  Outside Tsuen Wan Town Hall",Tai Ho Road No.30,76.0,57.0,76.0,45.6
Tai Ho Road No.30,Bus stop on Wai Tsuen Road outside Sam Tung Uk Garden,76.0,57.0,76.0,45.6
Bus stop on Wai Tsuen Road outside Sam Tung Uk Garden,"Tam Kon Po Street,  Outside Sha Tin Town Hall",76.0,57.0,76.0,45.6
"Tam Kon Po Street,  Outside Sha Tin Town Hall",Tsuen Wan Station Multi-Storey Carpark,76.0,57.0,76.0,45.6
Tsuen Wan Station Multi-Storey Carpark,"Tsuen Wan Market Street,  Outside Tsuen Wan Market",76.0,57.0,76.0,45.6
"Yuen Tun Circuit,  Outside Tsuen Wan Town Hall","Tai Wai Road,  Outside Kam Shan Building",76.0,38.0,76.0,38.0
"Tai Wai Road,  Outside Kam Shan Building",Tai Wai Station Bus Terminus,76.0,38.0,76.0,38.0
Tai Wai Station Bus Terminus,"Mei Tin Road Roundabout,  Outside Mei Fung House Mei Lam Estate",152.0,76.0,152.0,76.0
"Mei Tin Road Roundabout,  Outside Mei Fung House Mei Lam Estate",Tung Lo Wan Hill Road,76.0,38.0,76.0,38.0
Tung Lo Wan Hill Road,Chung Ling Road,76.0,38.0,76.0,38.0
Chung Ling Road,"Tai Wai Road,  Outside Kam Shan Building",76.0,38.0,76.0,38.0
"Tai Wai Road,  Outside Kam Shan Building",Mei Tin Road,76.0,38.0,76.0,38.0
Mei Tin Road,Tai Wai Station Bus Terminus,76.0,38.0,76.0,38.0
"Mei Tin Road Roundabout,  Outside Mei Fung House Mei Lam Estate",Tsuen Wan Station Multi-Storey Carpark,76.0,38.0,76.0,38.0
Tsuen Wan Station Multi-Storey Carpark,Tai Ho Road No.7-17,76.0,38.0,76.0,38.0
Tai Ho Road No.7-17,"Tsuen Wan Market Street,  Outside Tsuen Wan Market",76.0,38.0,76.0,38.0
"Pamela Youde Nethersole Eastern Hospital,  Outside Main Block","Tai Man Street,  Outside Neptune Terrace",380.0,114.0,380.0,114.0
"Tai Man Street,  Outside Neptune Terrace","Lee Chung Street,  Outside Chai Wan Factory",380.0,114.0,380.0,114.0
"Lee Chung Street,  Outside Chai Wan Factory","Tai Man Street,  Outside Block 4,  Koway Court",380.0,114.0,380.0,114.0
"Tai Man Street,  Outside Block 4,  Koway Court","Tai Man Street,  Outside Neptune Terrace",380.0,114.0,380.0,114.0
"Tai Man Street,  Outside Neptune Terrace","Pamela Youde Nethersole Eastern Hospital,  Outside Main Block",380.0,114.0,380.0,114.0
"Tin King Road,  Outside Leung King Commercial Complex","Tsun Wen Road,  Outside Jockey Club Yan Oi Tong Swimming Pool",76.0,57.0,76.0,57.0
"Shek Pai Tau Road,  outside Greenland Garden","Shek Pai Tau Road,  Outside Wai Cheung Industrial Centre",76.0,57.0,76.0,57.0
"Shek Pai Tau Road,  Outside Wai Cheung Industrial Centre","Lung Mun Road,  outside Glorious Garden",76.0,57.0,76.0,57.0
"Wu Chui Road,  outside Tip Sum House,  Butterfly Estate","Wu King Road,  outside Wu Poon House of Wu King Estate",76.0,57.0,76.0,57.0
"Wu King Road,  outside Wu Poon House of Wu King Estate","Hoi Chu Road,  Outside Goodview Garden",76.0,57.0,76.0,57.0
"Tuen Mun Heung Sze Wui Road,  outside Yau Oi Commercial Centre","Bute Street,  Near Carprio Mansion",76.0,57.0,76.0,57.0
"Bute Street,  Near Carprio Mansion","Tuen Mun Heung Sze Wui Road,  Outside Tuen Mun Central Bus Terminus",76.0,57.0,76.0,57.0
"Hoi Chu Road,  Opposite Goodview Garden","Wu King Road,  opposite Wu Poon House of Wu King Estate",76.0,57.0,76.0,57.0
"Wu King Road,  opposite Wu Poon House of Wu King Estate","Wu Chui Road,  outside Block 10 of Melody Garden",76.0,57.0,76.0,57.0
"Wu Chui Road,  outside Block 10 of Melody Garden","Lung Mun Road,  outside Butterfly Light Rail Station",76.0,57.0,76.0,57.0
"Lung Mun Road,  Outside Lung Mun LRT Station","Shek Pai Tau Road,  Opposite Po Leung Kuk Vicwood K.T.chong No.2 Primary School",76.0,57.0,76.0,57.0
"Shek Pai Tau Road,  Opposite Po Leung Kuk Vicwood K.T.chong No.2 Primary School","Tsun Wen Road,  Outside Hing Wai House,  Tai Hing Estate",76.0,57.0,76.0,57.0
"Tsun Wen Road,  Outside Hing Wai House,  Tai Hing Estate","Tin King Road,  Outside Leung King Commercial Complex",76.0,57.0,76.0,57.0
Tin Hau Station Bus Terminus,No.7-9 Ngan Mok Street,380.0,162.8571429,190.0,162.8571429
No.7-9 Ngan Mok Street,No. 39 Cloud View Road,380.0,162.8571429,190.0,162.8571429
No. 39 Cloud View Road,"Braemar Hill Road,  Outside Braemar Hill Mansion",380.0,162.8571429,190.0,162.8571429
"Braemar Hill Road,  Outside Braemar Hill Mansion",Bramear Hill Bus Terminus,380.0,162.8571429,190.0,162.8571429
Bramear Hill Bus Terminus,"Braemar Hill Road,  Outside Oxford Court",380.0,162.8571429,190.0,162.8571429
"Braemar Hill Road,  Outside Oxford Court",Po Luen Path,380.0,162.8571429,190.0,162.8571429
Po Luen Path,"Tin Hau Temple Road,  Outside Pacific Palisades",380.0,162.8571429,190.0,162.8571429
"Tin Hau Temple Road,  Outside Pacific Palisades",No. 132 Tin Hau Temple Road,380.0,162.8571429,190.0,162.8571429
No. 132 Tin Hau Temple Road,No. 30 Fortress Hill Road,380.0,162.8571429,190.0,162.8571429
No. 30 Fortress Hill Road,Fortress Hill Station,380.0,162.8571429,190.0,162.8571429
Fortress Hill Station,Tin Hau Station Bus Terminus,380.0,162.8571429,190.0,162.8571429
"Shun On Road,  Opposite Shun Tin Estate Bus Terminus","Lee On Road,  Outside Lee Ming House,  Shun Lee Estate",380.0,162.8571429,190.0,162.8571429
"Lee On Road,  Outside Lee Ming House,  Shun Lee Estate","New Clear Water Bay Road,  Opposite Social Welfare Department Choi Wan Sheltered Workshop & Hostel",380.0,162.8571429,190.0,162.8571429
"New Clear Water Bay Road,  Opposite Social Welfare Department Choi Wan Sheltered Workshop & Hostel",Ping Shek Public Transport Interchange,380.0,162.8571429,190.0,162.8571429
Ping Shek Public Transport Interchange,"Clear Water Bay Road,  Opposite Ping Shek Estate Catholic Primary School",380.0,162.8571429,190.0,162.8571429
"Clear Water Bay Road,  Opposite Ping Shek Estate Catholic Primary School","New Clear Water Bay Road,  Outside Boon Yuet House,  Choi Wan Estate",380.0,162.8571429,190.0,162.8571429
"New Clear Water Bay Road,  Outside Boon Yuet House,  Choi Wan Estate","Shun On Road,  Opposite Shun Tin Estate Bus Terminus",380.0,162.8571429,190.0,162.8571429
Tsz Tin Road,"Tsun Wen Road,  opposite Tuen Mun Catholic Secondary School",38.0,38.0,38.0,38.0
"Tsun Wen Road,  opposite Tuen Mun Catholic Secondary School","Tsun Wen Road,  Outside Tuen Mun School Dental Clinic",38.0,38.0,38.0,38.0
"Tsun Wen Road,  Outside Tuen Mun School Dental Clinic","Tsun Wen Road,  Outside Tuen Mun District Headquarters & Division Police Station",38.0,38.0,38.0,38.0
"Tuen Mun Heung Sze Wui Road,  outside On Ting Commercial Complex","Hoi Chu Road,  Opposite Goodview Garden",38.0,38.0,38.0,38.0
"Hoi Chu Road,  Opposite Goodview Garden",Nan Fung Centre,38.0,38.0,38.0,38.0
Nan Fung Centre,Mei Foo Station bus stop,38.0,38.0,38.0,38.0
Mei Foo Station bus stop,"Nathan Road,  outside Hollywood Plaza",38.0,38.0,38.0,38.0
"Nathan Road,  outside Hollywood Plaza","Top Glory Tower,  Gloucester Road",38.0,38.0,38.0,38.0
"Top Glory Tower,  Gloucester Road","Lockhart Road,  East of Marsh Road",38.0,38.0,38.0,38.0
"Lockhart Road,  East of Marsh Road","Lockhart Road,  Siu On Centre",38.0,38.0,38.0,38.0
"Lockhart Road,  Siu On Centre","Lockhart Road,  Outside The Broadway",38.0,38.0,38.0,38.0
"Lockhart Road,  Outside The Broadway",No.233-235 Hennessy Road,38.0,38.0,38.0,38.0
No.233-235 Hennessy Road,No.347 Hennessy Road,237.5,152.0,237.5,140.6
No.347 Hennessy Road,Yee Wo Street. No.2L,38.0,38.0,38.0,38.0
Yee Wo Street. No.2L,"Top Glory Tower,  Gloucester Road",38.0,38.0,38.0,38.0
"Top Glory Tower,  Gloucester Road","Nathan Road,  near Shan Tung Street",38.0,38.0,38.0,38.0
"Nathan Road,  near Shan Tung Street","Lai Chi Kok Road,  Outside Phase 4 Mei Foo Sun Chuen",38.0,38.0,38.0,38.0
"Lai Chi Kok Road,  Outside Phase 4 Mei Foo Sun Chuen",Lik Sang Plaza,38.0,38.0,38.0,38.0
Lik Sang Plaza,"Hoi Chu Road,  Outside Goodview Garden",38.0,38.0,38.0,38.0
"Tuen Mun Heung Sze Wui Road,  outside Town Centre Light Rail Station","Tsun Wen Road,  Outside Hing Wai House,  Tai Hing Estate",38.0,38.0,38.0,38.0
"Tsun Wen Road,  Outside Hing Wai House,  Tai Hing Estate","Tsun Wen Road,  outside Tuen Mun Catholic Secondary School",38.0,38.0,38.0,38.0
"Tsun Wen Road,  outside Tuen Mun Catholic Secondary School",Tsz Tin Road,38.0,38.0,38.0,38.0
"Yi Chun Street,  Outside Tung Yuen Restaurant","Hong Kin Road,  Outside Ming Shun Village",142.5,57.0,142.5,45.6
"Hong Kin Road,  Outside Ming Shun Village","Hong Kin Road,  Outside Seaside Villas",142.5,57.0,142.5,45.6
"Hong Kin Road,  Outside Seaside Villas","Hong Kin Road,  Ming Shun Village",142.5,57.0,142.5,45.6
"Hong Kin Road,  Ming Shun Village","Yi Chun Street,  Outside Tung Yuen Restaurant",142.5,57.0,142.5,45.6
Shek Pai Wan Estate Public Transport Interchange,"Nam Ning Street,  Outside Hoi Tsing Court",427.5,256.5,427.5,216.6
"Nam Ning Street,  Outside Hoi Tsing Court",No.178 Aberdeen Main Road,503.5,294.5,503.5,254.6
No.178 Aberdeen Main Road,"Wong Chuk Hang Road,  house no. 23",788.5,541.5,788.5,501.6
"Wong Chuk Hang Road,  house no. 23","Wong Chuk Hang Road,  house no. 49-51",864.5,579.5,864.5,539.6
"Wong Chuk Hang Road,  house no. 49-51","Wong Chuk Hang Road,  Eastbound Bus Bay Near Aberdeen Tunnel",826.5,579.5,826.5,539.6
"Wong Chuk Hang Road,  Eastbound Bus Bay Near Aberdeen Tunnel",No. 80-82 Morrison Hill Road,826.5,579.5,826.5,539.6
No. 80-82 Morrison Hill Road,No.32 Morrison Hill Road,826.5,579.5,826.5,539.6
No.32 Morrison Hill Road,No.221 Wan Chai Road,427.5,256.5,427.5,216.6
No.221 Wan Chai Road,No.187 Wan Chai Road,427.5,256.5,427.5,216.6
No.187 Wan Chai Road,No.151 Wan Chai Road,427.5,256.5,427.5,216.6
No.151 Wan Chai Road,"Fleming Road,  outside Tai Yau Building",199.5,114.0,199.5,102.6
"Fleming Road,  outside Tai Yau Building",No.233-235 Hennessy Road,199.5,114.0,199.5,102.6
No.347 Hennessy Road,"Lockhart Road,  outside Causeway Bay Plaza Phase 1",199.5,114.0,199.5,102.6
"Lockhart Road,  outside Causeway Bay Plaza Phase 1","Near President Theatre,  Cannon Street",598.5,437.0,598.5,425.6
"Near President Theatre,  Cannon Street",No.160 Wan Chai Road,142.5,57.0,142.5,45.6
No.160 Wan Chai Road,No.222 Wan Chai Road,142.5,57.0,142.5,45.6
No.222 Wan Chai Road,"Morrison Hill Road,  bus stop outside Happy Valley Racecourse",142.5,57.0,142.5,45.6
"Morrison Hill Road,  bus stop outside Happy Valley Racecourse","Wong Chuk Hang Road,  outside Wong Chuk Hang Recreation Ground",370.5,199.5,370.5,159.6
"Wong Chuk Hang Road,  outside Wong Chuk Hang Recreation Ground",No.36 Wong Chuk Hang Road,845.5,541.5,788.5,501.6
No.36 Wong Chuk Hang Road,"Aberdeen Praya Road,  Outside Ocean Court",921.5,579.5,864.5,539.6
"Aberdeen Praya Road,  Outside Ocean Court","Aberdeen Praya Road,  opposite to Aberdeen Bus Terminus",921.5,579.5,864.5,539.6
"Aberdeen Praya Road,  opposite to Aberdeen Bus Terminus",Opposite Sai On Street No.12,370.5,199.5,370.5,159.6
Opposite Sai On Street No.12,Shek Pai Wan Estate Public Transport Interchange,370.5,199.5,370.5,159.6
No.151 Wan Chai Road,No. 168 Johnston Road,228.0,142.5,228.0,114.0
No. 168 Johnston Road,No. 128 Johnston Road,228.0,142.5,228.0,114.0
No. 128 Johnston Road,No. 76 Johnston Road,228.0,142.5,228.0,114.0
No. 76 Johnston Road,No. 60 Johnston Road,228.0,142.5,228.0,114.0
No. 60 Johnston Road,No. 3-5 Tai Wong Street East,228.0,142.5,228.0,114.0
No. 3-5 Tai Wong Street East,No. 30 Tai Wong Street East,228.0,142.5,228.0,114.0
No. 30 Tai Wong Street East,"Johnston Road,  Outside Southorn Playground",228.0,142.5,228.0,114.0
"Johnston Road,  Outside Southorn Playground",No. 141-147 Johnston Road,228.0,142.5,228.0,114.0
No. 141-147 Johnston Road,No.160 Wan Chai Road,228.0,142.5,228.0,114.0
No.160 Wan Chai Road,Wanchai Road No.222,228.0,142.5,228.0,114.0
Wanchai Road No.222,"Morrison Hill Road,  bus stop outside Happy Valley Racecourse",228.0,142.5,228.0,114.0
Shek Pai Wan Estate Public Transport Interchange,"Nan Ning Street,  Outside Hoi Tsing Court",361.0,285.0,361.0,285.0
"Nan Ning Street,  Outside Hoi Tsing Court",No.178 Aberdeen Main Road,475.0,342.0,418.0,342.0
No.32 Morrison Hill Road,"Lockhart Road,  outside Causeway Bay Plaza Phase 1",399.0,323.0,399.0,323.0
"Near President Theatre,  Cannon Street","Wong Chuk Hang Road,  outside Wong Chuk Hang Recreation Ground",399.0,323.0,399.0,323.0
"Aberdeen Praya Road,  opposite to Aberdeen Bus Terminus","Sai On Street,  Opposite No.12",361.0,285.0,361.0,285.0
"Sai On Street,  Opposite No.12",Shek Pai Wan Estate Public Transport Interchange,361.0,285.0,361.0,285.0
"Nam Ning Street,  Outside Hoi Wun Court",Shek Pai Wan Estate Public Transport Interchange,114.0,57.0,57.0,57.0
Shek Pai Wan Estate Public Transport Interchange,"Wong Chuk Hang Road,  house no. 23",114.0,57.0,57.0,57.0
"Wong Chuk Hang Road,  house no. 23","Nan Ning Street,  Outside Hoi Tsing Court",114.0,57.0,57.0,57.0
No.178 Aberdeen Main Road,Wong Chuk Hang Station,114.0,57.0,57.0,57.0
Wong Chuk Hang Station,"Wong Chuk Hang Road,  house no. 23",114.0,57.0,57.0,57.0
"Wong Chuk Hang Road,  house no. 23",Wong Chuk Hang Station,114.0,57.0,57.0,57.0
Wong Chuk Hang Station,"Wong Chuk Hang Road,  outside Wong Chuk Hang Recreation Ground",114.0,57.0,57.0,57.0
"Aberdeen Praya Road,  opposite to Aberdeen Bus Terminus","Nam Ning Street,  Outside Hoi Wun Court",114.0,57.0,57.0,57.0
"Nam Ning Street,  Outside Hoi Wun Court","Aberdeen Main Road,  outside Kam Fung Building",114.0,57.0,57.0,57.0
"Aberdeen Main Road,  outside Kam Fung Building",Shek Pai Wan Estate Public Transport Interchange,114.0,57.0,57.0,57.0
Shek Pai Wan Estate Public Transport Interchange,Aberdeen Reservoir Road,142.5,142.5,142.5,142.5
Aberdeen Reservoir Road,"Sai On Street,  Outside Port Centre",142.5,142.5,142.5,142.5
"Sai On Street,  Outside Port Centre","Yue Kwong Road,  outside Shek Pai Wan Estate",142.5,142.5,142.5,142.5
"Yue Kwong Road,  outside Shek Pai Wan Estate",Shek Pai Wan Estate Public Transport Interchange,142.5,142.5,142.5,142.5
No.178 Aberdeen Main Road,"48-50 Aberdeen Main Road,  Outside Yip Yee Mansion",76.0,38.0,76.0,38.0
"48-50 Aberdeen Main Road,  Outside Yip Yee Mansion","Wong Chuk Hang Road,  house no. 23",76.0,38.0,76.0,38.0
"Wong Chuk Hang Road,  house no. 49-51","Wong Chuk Hang Road,  outside Wong Chuk Hang San Wai",76.0,38.0,76.0,38.0
"Wong Chuk Hang Road,  outside Wong Chuk Hang San Wai","Shouson Hill Road,  house no. 3A",76.0,38.0,76.0,38.0
"Shouson Hill Road,  house no. 3A","Shouson Hill Road,  Near Shouson Hill Road West",76.0,38.0,76.0,38.0
"Shouson Hill Road,  Near Shouson Hill Road West","Shouson Hill Road East,  house no. 1",76.0,38.0,76.0,38.0
"Shouson Hill Road East,  house no. 1","Deep Water Bay Road,  Outside Manderly Garden",76.0,38.0,76.0,38.0
"Deep Water Bay Road,  Outside Manderly Garden","Deep Water Bay Road,  Near Rockybank",76.0,38.0,76.0,38.0
"Deep Water Bay Road,  Near Rockybank","Wong Nai Chung Gap Road,  Opposite Hong Kong Cricket Club",76.0,38.0,76.0,38.0
"Wong Nai Chung Gap Road,  Opposite Hong Kong Cricket Club","Blue Pool Road,  near Green Lane",76.0,38.0,76.0,38.0
"Blue Pool Road,  near Green Lane","Morrison Hill Road,  house no. 32",76.0,38.0,76.0,38.0
"Morrison Hill Road,  house no. 32","Wong Nai Chung Road,  house no. 11-11A",76.0,38.0,76.0,38.0
"Wong Nai Chung Road,  house no. 11-11A","Lockhart Road,  outside Causeway Bay Plaza Phase 1",76.0,38.0,76.0,38.0
"Lockhart Road,  outside Causeway Bay Plaza Phase 1",No. 80-82 Morrison Hill Road,76.0,38.0,76.0,38.0
No. 80-82 Morrison Hill Road,"Jaffe Road, Percival Street",76.0,38.0,76.0,38.0
"Jaffe Road, Percival Street","Morrison Hill Road,  house no. 32",76.0,38.0,76.0,38.0
"Morrison Hill Road,  house no. 32","Lockhart Road,  outside Causeway Bay Plaza Phase 1",76.0,38.0,76.0,38.0
"Lockhart Road,  outside Causeway Bay Plaza Phase 1","Jaffe Road, Percival Street",76.0,38.0,76.0,38.0
"Jaffe Road, Percival Street","Wong Nai Chung Road,  near Blue Pool Road",76.0,38.0,76.0,38.0
"Wong Nai Chung Road,  near Blue Pool Road","Tai Hang Road,  junction with Wong Nai Chung Gap Road",76.0,38.0,76.0,38.0
"Tai Hang Road,  junction with Wong Nai Chung Gap Road","Wong Nai Chung Gap Road,  Outside Hong Kong Tennis Centre",76.0,38.0,76.0,38.0
"Wong Nai Chung Gap Road,  Outside Hong Kong Tennis Centre","Deep Water Bay Road,  Near Lynx Hill",76.0,38.0,76.0,38.0
"Deep Water Bay Road,  Near Lynx Hill","Deep Water Bay Road,  Opposite Manderly Garden",76.0,38.0,76.0,38.0
"Deep Water Bay Road,  Opposite Manderly Garden","Shouson Hill Road East,  house no. 8",76.0,38.0,76.0,38.0
"Shouson Hill Road East,  house no. 8","Shouson Hill Road westbound,  Near Shouson Hill Road West",76.0,38.0,76.0,38.0
"Shouson Hill Road westbound,  Near Shouson Hill Road West","Shouson Hill Road,  Opposite house no. 3A",76.0,38.0,76.0,38.0
"Shouson Hill Road,  Opposite house no. 3A","opposite to Wong Chuk Hang San Wai,  Wong Chuk Hang Road",76.0,38.0,76.0,38.0
"opposite to Wong Chuk Hang San Wai,  Wong Chuk Hang Road","Wong Chuk Hang Road,  outside Wong Chuk Hang Sports Centre",76.0,38.0,76.0,38.0
"Wong Chuk Hang Road,  outside Wong Chuk Hang Sports Centre","Wong Chuk Hang Road,  Wong Chuk Hang Recreation Ground",76.0,38.0,76.0,38.0
"Wong Chuk Hang Road,  Wong Chuk Hang Recreation Ground",No.36 Wong Chuk Hang Road,76.0,38.0,76.0,38.0
"Aberdeen Praya Road,  opposite to Aberdeen Bus Terminus","Nam Ning Street,  Outside Hoi Tsing Court",76.0,38.0,76.0,38.0
Yiu Tung Estate Bus Terminus,"Yiu Hing Road,  Outside Tung Shing Court",570.0,285.0,380.0,285.0
"Yiu Hing Road,  Outside Tung Shing Court","Yiu Hing Road,  Opposite Smiling Shau Kei Wan Plaza",570.0,285.0,380.0,285.0
"Yiu Hing Road,  Opposite Smiling Shau Kei Wan Plaza",No. 137 Sai Wan Ho Street,570.0,285.0,380.0,285.0
No. 137 Sai Wan Ho Street,No.12 Tai On Street,570.0,285.0,380.0,285.0
No.12 Tai On Street,No. 8 Shing On Street,570.0,285.0,380.0,285.0
No. 8 Shing On Street,"Yiu Hung Road,  Opposite Hing Tung Shopping Centre",570.0,285.0,380.0,285.0
"Yiu Hung Road,  Opposite Hing Tung Shopping Centre","Yiu Hing Road,  Outside Yiu Hei House",570.0,285.0,380.0,285.0
"Yiu Hing Road,  Outside Yiu Hei House","Yiu Hing Road,  Outside Yiu Wah House",570.0,285.0,380.0,285.0
"Yiu Hing Road,  Outside Yiu Wah House",Yiu Tung Estate Bus Terminus,570.0,285.0,380.0,285.0
"United Christian Hospital,  Outside Sir Run Run Shaw Building",No.26-28 Yue Man Square,570.0,285.0,380.0,285.0
No.26-28 Yue Man Square,Northern Kerbside Lane Of Sau Nga Road At A Point About 95m East Of Its Junction With Hip Wo Street,570.0,285.0,380.0,285.0
Northern Kerbside Lane Of Sau Nga Road At A Point About 95m East Of Its Junction With Hip Wo Street,"United Christian Hospital,  Outside Sir Run Run Shaw Building",570.0,285.0,380.0,285.0
"Wai Ming Road,  Opposite Flora Plaza","Pak Wo Road,  Outside Yan Shing Court",228.0,228.0,228.0,228.0
"Pak Wo Road,  Outside Yan Shing Court","Yat Ming Road,  Outside Pak Fuk Tin Sum Playground",228.0,228.0,228.0,228.0
"Yat Ming Road,  Outside Pak Fuk Tin Sum Playground","Yat Ming Road,  Avon Park",228.0,228.0,228.0,228.0
"Yat Ming Road,  Avon Park","Yat Ming Road,  Dawning Views",228.0,228.0,228.0,228.0
"Yat Ming Road,  Dawning Views",Wo Hop Shek San Tsuen,228.0,228.0,228.0,228.0
Wo Hop Shek San Tsuen,Bus stop at Jockey Club Road westbound near Petrol Station,228.0,228.0,228.0,228.0
Bus stop at Jockey Club Road westbound near Petrol Station,Fanling Town Centre,228.0,228.0,228.0,228.0
Fanling Town Centre,Luen Hing Street outside Luen Wo Hui,228.0,228.0,228.0,228.0
Luen Hing Street outside Luen Wo Hui,Luen Fat Street (Lamp Post EA8498),228.0,228.0,228.0,228.0
Luen Fat Street (Lamp Post EA8498),Lok Yip Road,228.0,228.0,228.0,228.0
Lok Yip Road,The bus layby on Wo Hing Road southbound opposite to Wo Hing Tsuen,228.0,228.0,228.0,228.0
The bus layby on Wo Hing Road southbound opposite to Wo Hing Tsuen,"Yat Min Road,  opposite Avon Park",228.0,228.0,228.0,228.0
"Yat Min Road,  opposite Avon Park","Wah Ming Road,  Outside Yan Fai House,  Yan Shing Court",228.0,228.0,228.0,228.0
"Wah Ming Road,  Outside Yan Fai House,  Yan Shing Court","Wai Ming Road,  Opposite Flora Plaza",114.0,114.0,114.0,114.0
Yung Shing Court,"Wai Ming Road,  Opposite Flora Plaza",114.0,114.0,114.0,114.0
"Wah Ming Road,  Outside Yan Fai House,  Yan Shing Court",Yung Shing Court,114.0,114.0,114.0,114.0
San Fung Road,"Luen Wo Road,  Outside Luen Wo Hui Market",38.0,38.0,38.0,38.0
