stop_u,stop_v,max_c_weekday,min_c_weekday,max_c_weekend,min_c_weekend
The Peak( Public Transport Terminus),Guildford Road,228.0,76.0,228.0,76.0
Guildford Road,No.18 Ice House Street,228.0,76.0,228.0,76.0
No.18 Ice House Street,"Pedder Street,  near MTR exit",694.8571429,304.0,513.0,247.0
"Pedder Street,  near MTR exit",Central (Hong Kong Station Public Transport Interchange),580.8571429,228.0,399.0,171.0
Central (Hong Kong Station Public Transport Interchange),"Man Cheung Street,  lay-by outisde Two International Finance Centre Shopping Mall",646.0,342.0,570.0,285.0
"Man Cheung Street,  lay-by outisde Two International Finance Centre Shopping Mall","Connaught Road Central,  Outside CityHall Carpark",646.0,342.0,570.0,285.0
"Connaught Road Central,  Outside CityHall Carpark","Cotton Tree Drive,  Bus Bay Opposite Murray Building",646.0,342.0,570.0,285.0
"Cotton Tree Drive,  Bus Bay Opposite Murray Building",Guildford Road,228.0,76.0,228.0,76.0
Guildford Road,Matilda & War Memorial Hospital,228.0,76.0,228.0,76.0
Matilda & War Memorial Hospital,The Peak( Public Transport Terminus),228.0,76.0,228.0,76.0
"Fuk Man Road Public Light Bus Terminus,  Outside King Wah Building","Hiram^s Highway,  Outside Hebe Haven Yacht Club",541.5,418.0,513.0,418.0
"Hiram^s Highway,  Outside Hebe Haven Yacht Club","Hiram^s Highway,  Outside Marina Cove Stage 2",1035.5,532.0,1007.0,532.0
"Hiram^s Highway,  Outside Marina Cove Stage 2","Clear Water Bay Road,  Opposite Las Pinadas",142.5,57.0,114.0,57.0
"Clear Water Bay Road,  Opposite Las Pinadas",Tseng Lan Shue,142.5,57.0,114.0,57.0
Tseng Lan Shue,"Clear Water Bay Road,  Outside Choi Wan Commercial Complex Phase Iib",142.5,57.0,114.0,57.0
"Clear Water Bay Road,  Outside Choi Wan Commercial Complex Phase Iib","Clear Water Bay Road,  outside Tsuen Shek House,  Ping Shek Estate",826.5,608.0,703.0,608.0
"Clear Water Bay Road,  outside Tsuen Shek House,  Ping Shek Estate","Telford Plaza Phase Ii,  Ground Floor",142.5,57.0,114.0,57.0
"Telford Plaza Phase Ii,  Ground Floor","Lung Cheung Road,  Near Ngau Chi Wan Fire Station",142.5,57.0,114.0,57.0
"Lung Cheung Road,  Near Ngau Chi Wan Fire Station",Tseng Lan Shue,142.5,57.0,114.0,57.0
Tseng Lan Shue,"Fuk Man Road Public Light Bus Terminus,  Outside King Wah Building",142.5,57.0,114.0,57.0
"Jaffe Road, Percival Street",No.482 Lockhart Road,114.0,57.0,76.0,57.0
No.482 Lockhart Road,"Lockhart Road,  Marsh Road",114.0,57.0,76.0,57.0
"Lockhart Road,  Marsh Road",No. 256 Hennessy Road,114.0,57.0,76.0,57.0
No. 256 Hennessy Road,No. 22 Hennessy Road,171.0,95.0,133.0,95.0
No. 22 Hennessy Road,"Queensway,  outside Pacific Place",171.0,95.0,133.0,95.0
"Queensway,  outside Pacific Place","Caine Road,  Caritas House",114.0,57.0,76.0,57.0
"Caine Road,  Caritas House","Caine Road,  Shelly Street",114.0,57.0,76.0,57.0
"Caine Road,  Shelly Street","Caine Road,  Shing Wong Street",114.0,57.0,76.0,57.0
"Caine Road,  Shing Wong Street","Bonham Road,  Euston Court",114.0,57.0,76.0,57.0
"Bonham Road,  Euston Court",No. 64 Bonham Road,114.0,57.0,76.0,57.0
No. 64 Bonham Road,"Bonham Road,  Centre Street",114.0,57.0,76.0,57.0
"Bonham Road,  Centre Street","Pok Fu Lam Road, East Gate of University of Hong Kong",114.0,57.0,76.0,57.0
"Pok Fu Lam Road, East Gate of University of Hong Kong","Pok Fu Lam Road,  East Gate of University of Hong Kong",114.0,57.0,76.0,57.0
"Pok Fu Lam Road,  East Gate of University of Hong Kong","Pok Fu Lam Road,  West Gate of University of Hong Kong",114.0,57.0,76.0,57.0
"Pok Fu Lam Road,  West Gate of University of Hong Kong","Pok Fu Lam Road,  opposite the Belcher",114.0,57.0,76.0,57.0
"Pok Fu Lam Road,  opposite the Belcher","Pok Fu Lam Road,  Pokfield Road Bus Terminus",114.0,57.0,76.0,57.0
"Pok Fu Lam Road,  Pokfield Road Bus Terminus","Pok Fu Lam Road,  Pok Fu Lam Road Playground",114.0,57.0,76.0,57.0
"Pok Fu Lam Road,  Pok Fu Lam Road Playground","Pok Fu Lam Road,  Queen Mary Hospital",114.0,57.0,76.0,57.0
"Pok Fu Lam Road,  Queen Mary Hospital",Bisney Road,114.0,57.0,76.0,57.0
Bisney Road,"Sandy Bay Road,  The Duchess of Kent Children?????s Hospital",114.0,57.0,76.0,57.0
"Sandy Bay Road,  The Duchess of Kent Children?????s Hospital",Scenic Villa,114.0,57.0,76.0,57.0
Scenic Villa,"Sha Wan Drive,  MacLehose Medical Rehabilitation Centre",114.0,57.0,76.0,57.0
"Sha Wan Drive,  MacLehose Medical Rehabilitation Centre","Sandy Bay Road,  The Duchess of Kent Children?????s Hospital",228.0,114.0,152.0,114.0
"Sandy Bay Road,  The Duchess of Kent Children?????s Hospital","Sha Wan Drive,  Stanley Ho Sports Centre",114.0,57.0,76.0,57.0
"Sha Wan Drive,  Stanley Ho Sports Centre","Sha Wan Drive,  MacLehose Medical Rehabilitation Centre",228.0,114.0,152.0,114.0
"Sha Wan Drive,  MacLehose Medical Rehabilitation Centre",Cyberport Public Transport Interchange,114.0,57.0,76.0,57.0
Cyberport Public Transport Interchange,"Sha Wan Drive,  Stanley Ho Sports Centre",228.0,114.0,152.0,114.0
"Sha Wan Drive,  Stanley Ho Sports Centre",Cyberport Public Transport Interchange,114.0,57.0,76.0,57.0
"Sandy Bay Road,  The Duchess of Kent Children?????s Hospital",Consort Rise,114.0,57.0,76.0,57.0
Consort Rise,"Pok Fu Lam Road,  Mount Davis Road",114.0,57.0,76.0,57.0
"Pok Fu Lam Road,  Mount Davis Road","Pok Fu Lam Road,  opposite to Pokfield Road Bus Terminus",114.0,57.0,76.0,57.0
"Pok Fu Lam Road,  opposite to Pokfield Road Bus Terminus","Pok Fu Lam Road,  Belcher Gardens",114.0,57.0,76.0,57.0
"Pok Fu Lam Road,  Belcher Gardens","Pok Fu Lam Road,  Yam Pak Building",114.0,57.0,76.0,57.0
"Pok Fu Lam Road,  Yam Pak Building","Bonham Road,  St. Paul?????s College",114.0,57.0,76.0,57.0
"Bonham Road,  St. Paul?????s College","Bonham Road,  Hong Kong University",114.0,57.0,76.0,57.0
"Bonham Road,  Hong Kong University","Bonham Road,  Ning Yeung Terrace",114.0,57.0,76.0,57.0
"Bonham Road,  Ning Yeung Terrace","Bonham Road,  Eastern Street",114.0,57.0,76.0,57.0
"Bonham Road,  Eastern Street","Bonham Road,  High Street",114.0,57.0,76.0,57.0
"Bonham Road,  High Street","Bonham Road,  Hospital Road",114.0,57.0,76.0,57.0
"Bonham Road,  Hospital Road","Caine Road,  Ladder Street",114.0,57.0,76.0,57.0
"Caine Road,  Ladder Street",No. 119 ????? 125 Caine Road,114.0,57.0,76.0,57.0
No. 119 ????? 125 Caine Road,No. 79 Caine Road,114.0,57.0,76.0,57.0
No. 79 Caine Road,Queensway outside Admiralty Garden near Admiralty Station Exit C1,114.0,57.0,76.0,57.0
Queensway outside Admiralty Garden near Admiralty Station Exit C1,"Hennessy Road,  outside Asian House",285.0,171.0,228.0,171.0
"Hennessy Road,  outside Asian House","No. 381 -383 Hennessy Road,   Fuji Building",114.0,57.0,76.0,57.0
"No. 381 -383 Hennessy Road,   Fuji Building",No. 483 Lockhart Road,114.0,57.0,76.0,57.0
No. 483 Lockhart Road,"Lockhart Road,  Percival Street",114.0,57.0,76.0,57.0
Hang Hau Station Public Transport Interchange,"Po Ning Road,  Outside Tseung Kwan O Hospital",456.0,60.8,456.0,60.8
"Po Ning Road,  Outside Tseung Kwan O Hospital","Clear Water Bay Road,  Outside Rose De Cosa",380.0,38.0,380.0,38.0
"Clear Water Bay Road,  Outside Rose De Cosa","Clear Water Bay Road,  Outside Tai Po Tsai Tsuen",380.0,38.0,380.0,38.0
"Clear Water Bay Road,  Outside Tai Po Tsai Tsuen","Clear Water Bay Road,  near HKUST",380.0,38.0,380.0,38.0
"Clear Water Bay Road,  near HKUST","Hiram^s Highway,  opposite Marina Cove Stage 2",380.0,38.0,380.0,38.0
"Hiram^s Highway,  opposite Marina Cove Stage 2","Hiram^s Highway,  Opposite to Hebe Haven Yacht Club",380.0,38.0,380.0,38.0
"Hiram^s Highway,  Opposite to Hebe Haven Yacht Club",Wai Man Road PLB Terminus,380.0,38.0,380.0,38.0
Wai Man Road PLB Terminus,"Po Tung Road,  Sai Kung Town Hall",380.0,38.0,380.0,38.0
"Po Tung Road,  Sai Kung Town Hall","Hiram^s Highway,  Outside Hebe Haven Yacht Club",494.0,114.0,494.0,114.0
"Hiram^s Highway,  Outside Marina Cove Stage 2","Hiram^s Highway,  Outside Sai Kung Central Primary School",380.0,38.0,380.0,38.0
"Hiram^s Highway,  Outside Sai Kung Central Primary School","Clear Water Bay Road,  Opposite to Tai Po Tsai Tsuen",380.0,38.0,380.0,38.0
"Clear Water Bay Road,  Opposite to Tai Po Tsai Tsuen","Po Ning Road,  opposite to Tseung Kwan O Hospital",380.0,38.0,380.0,38.0
"Po Ning Road,  opposite to Tseung Kwan O Hospital","opposite East Point City,  Block 6",570.0,180.5,570.0,114.0
"opposite East Point City,  Block 6",Hang Hau Station Public Transport Interchange,380.0,38.0,380.0,38.0
Hang Hau Station Public Transport Interchange,"Hong Keung Street,  Opposite Hong King Building",570.0,570.0,228.0,76.0
"Hong Keung Street,  Opposite Hong King Building","Po Ning Road,  Outside Hau Tak Estate",570.0,570.0,228.0,76.0
"Po Ning Road,  Outside Hau Tak Estate",Prince Edward Road East No.702B,570.0,570.0,228.0,76.0
Prince Edward Road East No.702B,"Po Shun Road,  Outside Chung Ming Court",570.0,570.0,228.0,76.0
"Po Shun Road,  Outside Chung Ming Court",Rhythm Garden Block 7,570.0,570.0,228.0,76.0
Rhythm Garden Block 7,No.398 Kwun Tong Road,570.0,570.0,228.0,76.0
No.398 Kwun Tong Road,"Po Shun Road,  Outside Tseung Kwan O Swimming Pool",570.0,570.0,228.0,76.0
"Po Shun Road,  Outside Tseung Kwan O Swimming Pool",No.368 Kwun Tong Road,570.0,570.0,228.0,76.0
No.368 Kwun Tong Road,"Chung Wa Road,  Opposite Block 6,  East Point City",570.0,570.0,228.0,76.0
"Chung Wa Road,  Opposite Block 6,  East Point City",Hang Hau Station Public Transport Interchange,1330.0,1197.0,646.0,209.0
Hang Hau Station Public Transport Interchange,No.320 Kwun Tong Road,570.0,570.0,228.0,76.0
No.320 Kwun Tong Road,Kwun Tong Road near Sheung Yee Road flyover,855.0,703.0,513.0,190.0
Kwun Tong Road near Sheung Yee Road flyover,"Kwun Tong Road,  Near Lamp Post No.AB1799",855.0,703.0,513.0,190.0
"Kwun Tong Road,  Near Lamp Post No.AB1799","Kwun Tong Road,  Near Lamp Post No.CF1683",855.0,703.0,513.0,190.0
"Kwun Tong Road,  Near Lamp Post No.CF1683","Lung Cheung Road,  Outside Hung Ngok House,  Choi Hung Estate",855.0,703.0,513.0,190.0
"Lung Cheung Road,  Outside Hung Ngok House,  Choi Hung Estate",No.222 Choi Hung Road,760.0,627.0,418.0,133.0
No.222 Choi Hung Road,Tai Yau Street No.31,760.0,627.0,418.0,133.0
Tai Yau Street No.31,"Hong Keung Street,  Opposite Hong King Building",902.5,722.0,560.5,209.0
"Hong Keung Street,  Opposite Hong King Building",Prince Edward Road East No.702B,570.0,570.0,228.0,76.0
Prince Edward Road East No.702B,Rhythm Garden Block 7,570.0,570.0,228.0,76.0
Rhythm Garden Block 7,"Prince Edward Road East,  Near Lamp Post No.khm33",570.0,570.0,228.0,76.0
"Prince Edward Road East,  Near Lamp Post No.khm33","Kwun Tong Road,  Outside St. Joseph^s Anglo-chinese Primary School",760.0,627.0,418.0,133.0
"Kwun Tong Road,  Outside St. Joseph^s Anglo-chinese Primary School","Kwun Tong Road,  Opposite to Telford Gardens",855.0,703.0,513.0,190.0
"Kwun Tong Road,  Opposite to Telford Gardens","Kwun Tong Road,  Near Lamp Post No.AB1737",855.0,703.0,513.0,190.0
"Kwun Tong Road,  Near Lamp Post No.AB1737",No.275 Kwun Tong Road,855.0,703.0,513.0,190.0
No.275 Kwun Tong Road,No.315 Kwun Tong Road,855.0,703.0,513.0,190.0
No.315 Kwun Tong Road,Kwun Tong Road outside Ngau Tau Kok Station,855.0,703.0,513.0,190.0
Kwun Tong Road outside Ngau Tau Kok Station,No.371 Kwun Tong Road,855.0,703.0,513.0,190.0
No.371 Kwun Tong Road,"Kwun Tong Road,  Near Lamp Post No.AA0643",855.0,703.0,513.0,190.0
"Kwun Tong Road,  Near Lamp Post No.AA0643","Tseung Kwan O Road,  Outside Kwun Tong Police Station",855.0,703.0,513.0,190.0
"Tseung Kwan O Road,  Outside Kwun Tong Police Station","Po Shun Road,  Outside Tseung Kwan O Swimming Pool",855.0,703.0,513.0,190.0
"Po Shun Road,  Outside Tseung Kwan O Swimming Pool","Chung Wa Road,  Opposite Block 6,  East Point City",855.0,703.0,513.0,190.0
"Ngan O Road,  Outside Yuk Ming Court","Po Ning Road,  opposite to Tseung Kwan O Hospital",95.0,76.0,95.0,57.0
"Po Ning Road,  opposite to Tseung Kwan O Hospital","Po Ning Road,  Outside Hau Tak Estate",209.0,133.0,209.0,114.0
"Po Ning Road,  Outside Hau Tak Estate","Po Shun Road,  Outside Chung Ming Court",589.0,332.5,589.0,247.0
"Po Shun Road,  Outside Chung Ming Court",No.398 Kwun Tong Road,285.0,133.0,285.0,114.0
No.398 Kwun Tong Road,No.368 Kwun Tong Road,285.0,133.0,285.0,114.0
No.368 Kwun Tong Road,No.320 Kwun Tong Road,285.0,133.0,285.0,114.0
"Lung Cheung Road,  Outside Hung Ngok House,  Choi Hung Estate","Prince Edward Road East,  Near Lamp Post No.KHM33",95.0,76.0,95.0,57.0
"Prince Edward Road East,  Near Lamp Post No.KHM33","Kwun Tong Road,  Outside St. Joseph^s Anglo-chinese Primary School",95.0,76.0,95.0,57.0
"Chung Wa Road,  Opposite Block 6,  East Point City","Ngan O Road,  Outside Yuk Ming Court",95.0,76.0,95.0,57.0
Hang Hau Station Public Transport Interchange,"Po Ning Road,  Outside Hau Tak Estate",190.0,57.0,190.0,57.0
"Hong Keung Street,  Opposite Hong King Building","Prince Edward Road East,  Near Lamp Post No.khm33",190.0,57.0,190.0,57.0
Clear Water Bay Second Beach GMB Stand,Clear Water Bay Apartments,276.8571429,114.0,276.8571429,114.0
Clear Water Bay Apartments,"Tai Au Mun Road,  Near Tai Wan Tau Road",114.0,57.0,114.0,57.0
"Tai Au Mun Road,  Near Tai Wan Tau Road","Clear Water Bay Road,  Near Sheung Sze Wan Road",114.0,57.0,114.0,57.0
"Clear Water Bay Road,  Near Sheung Sze Wan Road","Clear Water Bay Road,  Near Ha Yeung Road",276.8571429,114.0,276.8571429,114.0
"Clear Water Bay Road,  Near Ha Yeung Road","Clear Water Bay Road,  Opposite Sheung Yeung",114.0,57.0,114.0,57.0
"Clear Water Bay Road,  Opposite Sheung Yeung","Clear Water Bay Road,  Near High Junk Peak Country Trail",114.0,57.0,114.0,57.0
"Clear Water Bay Road,  Near High Junk Peak Country Trail","Clear Water Bay Road,  Outside Wat Sum Village",276.8571429,114.0,276.8571429,114.0
"Clear Water Bay Road,  Outside Wat Sum Village","Clear Water Bay Road,  Opposite Silverstand Mart",276.8571429,114.0,276.8571429,114.0
"Clear Water Bay Road,  Opposite Silverstand Mart","Clear Water Bay Road,  Opposite Sussex Lodge",114.0,57.0,114.0,57.0
"Clear Water Bay Road,  Opposite Sussex Lodge","Hang Hau Road,  Opposite Tseung Kwan O Hospital",114.0,57.0,114.0,57.0
"Hang Hau Road,  Opposite Tseung Kwan O Hospital","Po Ning Road,  opposite to Tseung Kwan O Hospital",114.0,57.0,114.0,57.0
"Po Shun Road,  Outside Chung Ming Court","Kwun Tong Road,  Outside New City Centre",114.0,57.0,114.0,57.0
"Kwun Tong Road,  Outside New City Centre",Hoi Yuen Raod No. 62,114.0,57.0,114.0,57.0
Hoi Yuen Raod No. 62,No.54 Hoi Yuen Road,114.0,57.0,114.0,57.0
No.54 Hoi Yuen Road,Kwun Tong Ferry Pier Light Bus Terminus,114.0,57.0,114.0,57.0
Kwun Tong Ferry Pier Light Bus Terminus,No.57 King Yip Street,114.0,57.0,114.0,57.0
No.57 King Yip Street,"Kwun Tong Road,  Outside New City Centre",114.0,57.0,114.0,57.0
"Kwun Tong Road,  Outside New City Centre","Tseung Kwan O Road,  Outside Kwun Tong Recreation Ground",114.0,57.0,114.0,57.0
"Tseung Kwan O Road,  Outside Kwun Tong Recreation Ground","Po Shun Road,  Outside Tseung Kwan O Swimming Pool",114.0,57.0,114.0,57.0
"Po Shun Road,  Outside Tseung Kwan O Swimming Pool","Po Ning Road,  Opposite Hau Tak Estate",304.0,199.5,304.0,133.0
"Po Ning Road,  Opposite Hau Tak Estate","Po Ning Road,  Outside Tseung Kwan O Hospital",114.0,57.0,114.0,57.0
"Po Ning Road,  Outside Tseung Kwan O Hospital","Hang Hau Road,  Outside Tseung Kwan O Hospital",114.0,57.0,114.0,57.0
"Hang Hau Road,  Outside Tseung Kwan O Hospital",Clear Water Bay Road No. 328,114.0,57.0,114.0,57.0
Clear Water Bay Road No. 328,"Clear Water Bay Road,  Outside Golden Cove Lookout Phase I",114.0,57.0,114.0,57.0
"Clear Water Bay Road,  Outside Golden Cove Lookout Phase I","Clear Water Bay Road Southbound,  Near Mang Kung Uk Road",114.0,57.0,114.0,57.0
"Clear Water Bay Road Southbound,  Near Mang Kung Uk Road",Clear Water Bay Second Beach GMB Stand,114.0,57.0,114.0,57.0
Tseung Kwan O Station Public Transport Interchange,"Tong Yin Street,  Outside Pkl Wong Wing Shu Primary School",162.8571429,57.0,162.8571429,57.0
"Tong Yin Street,  Outside Pkl Wong Wing Shu Primary School","Tong Ming Street,  Outside Sheung Ming House,  Sheung Tak Estate",162.8571429,57.0,162.8571429,57.0
"Tong Ming Street,  Outside Sheung Ming House,  Sheung Tak Estate","Chiu Shun Road,  Outside Yuk Ming Court",162.8571429,57.0,162.8571429,57.0
"Chiu Shun Road,  Outside Yuk Ming Court","Hang Hau Road,  Outside Tseung Kwan O Hospital",162.8571429,57.0,162.8571429,57.0
"Hang Hau Road,  Outside Tseung Kwan O Hospital",Clear Water Bay Second Beach GMB Stand,162.8571429,57.0,162.8571429,57.0
Clear Water Bay Apartments,"Clear Water Bay Road,  Near Sheung Sze Wan Road",162.8571429,57.0,162.8571429,57.0
"Clear Water Bay Road,  Near Ha Yeung Road","Clear Water Bay Road,  Near High Junk Peak Country Trail",162.8571429,57.0,162.8571429,57.0
"Clear Water Bay Road,  Opposite Silverstand Mart","Chiu Shun Road,  outside Tin Ha Wan Village",162.8571429,57.0,162.8571429,57.0
"Chiu Shun Road,  outside Tin Ha Wan Village",Po Yap Road outside Bauhinia Garden,162.8571429,57.0,162.8571429,57.0
Po Yap Road outside Bauhinia Garden,Tseung Kwan O Station Public Transport Interchange,162.8571429,57.0,162.8571429,57.0
Hong Kong University of Science and Technology (South Station),"TVB City,  Outside Shaw House",87.69230769,57.0,45.6,45.6
"TVB City,  Outside Shaw House","Clear Water Bay Road,  Outside Tai Po Tsai Tsuen",87.69230769,57.0,45.6,45.6
"Clear Water Bay Road,  Outside Tai Po Tsai Tsuen","Clear Water Bay Road,  Opposite Las Pinadas",87.69230769,57.0,45.6,45.6
"Clear Water Bay Road,  Opposite Las Pinadas","Clear Water Bay Road,  Opposite Pik Uk Correctional Institute",486.69230769,418.0,444.6,406.6
"Clear Water Bay Road,  Opposite Pik Uk Correctional Institute","Clear Water Bay Road,  Opposite Gold Villa",486.69230769,418.0,444.6,406.6
"Clear Water Bay Road,  Opposite Gold Villa",No.75b Clear Water Bay Road,87.69230769,57.0,45.6,45.6
No.75b Clear Water Bay Road,No.206 Clear Water Bay Road,87.69230769,57.0,45.6,45.6
No.206 Clear Water Bay Road,"Clear Water Bay Road,  Near Lung Wo Tsuen",87.69230769,57.0,45.6,45.6
"Clear Water Bay Road,  Near Lung Wo Tsuen","Shun Lee Tsuen Road,  Outside Lee Hong House,  Shun Lee Estate",87.69230769,57.0,45.6,45.6
"Shun Lee Tsuen Road,  Outside Lee Hong House,  Shun Lee Estate","Shun Lee Tsuen Road,  Outside On Chung House,  Shun On Estate",201.69230769,133.0,159.6,121.6
"Shun Lee Tsuen Road,  Outside On Chung House,  Shun On Estate","Ngau Tau Kok Road,  Outside Block 2,  Yue Man Centre",87.69230769,57.0,45.6,45.6
"Ngau Tau Kok Road,  Outside Block 2,  Yue Man Centre","Hong Ning Road,  Outside Hong Ning Court",87.69230769,57.0,45.6,45.6
"Hong Ning Road,  Outside Hong Ning Court","Hong Ning Road,  Outside Kwun Tong Peace Clinic",87.69230769,57.0,45.6,45.6
"Hong Ning Road,  Outside Kwun Tong Peace Clinic","Hong Ning Road,  Opposite Sau Mau Ping District Police Headquarter And Divisional Police Station",87.69230769,57.0,45.6,45.6
"Hong Ning Road,  Opposite Sau Mau Ping District Police Headquarter And Divisional Police Station","Shun Lee Tsuen Road,  Opposite Carmel Leung Sing Tak School",87.69230769,57.0,45.6,45.6
"Shun Lee Tsuen Road,  Opposite Carmel Leung Sing Tak School","Shun Lee Tsuen Road,  Outside Shun Lee Tsuen Leisure Centre",201.69230769,133.0,159.6,121.6
"Shun Lee Tsuen Road,  Outside Shun Lee Tsuen Leisure Centre","Clear Water Bay Road,  Outside Man King Terrace",87.69230769,57.0,45.6,45.6
"Clear Water Bay Road,  Outside Man King Terrace","Clear Water Bay Road,  Outside Gold Villa",87.69230769,57.0,45.6,45.6
"Clear Water Bay Road,  Outside Gold Villa","Clear Water Bay Road,  Outside Pik Uk Correctional Institute",486.69230769,418.0,444.6,406.6
"Clear Water Bay Road,  Outside Pik Uk Correctional Institute","Clear Water Bay Road,  Outside Las Pinadas",486.69230769,418.0,444.6,406.6
"Clear Water Bay Road,  Outside Las Pinadas","Clear Water Bay Road,  Opposite Tai Po Tsai Tsuen",87.69230769,57.0,45.6,45.6
"Clear Water Bay Road,  Opposite Tai Po Tsai Tsuen",Hong Kong University of Science and Technology (South Station),87.69230769,57.0,45.6,45.6
416 Ma Tau Wai Road,"Po Lam Road North,  Po Lam Fire Station",57.0,57.0,0.0,0.0
"Po Lam Road North,  Po Lam Fire Station","Hong Sing Garden Bus Terminus,  Outside King Ling College",57.0,57.0,0.0,0.0
"Hong Sing Garden Bus Terminus,  Outside King Ling College",Po Lam Road North opposite Ming On House of Ying Ming Court,57.0,57.0,0.0,0.0
Po Lam Road North opposite Ming On House of Ying Ming Court,"Po Lam Road North,  Outside Hong Sing Garden",57.0,57.0,0.0,0.0
"Po Lam Road North,  Outside Hong Sing Garden","Ma Tau Wai Road,  Outside Ma Tau Wai Road Playground",57.0,57.0,0.0,0.0
"Ma Tau Wai Road,  Outside Ma Tau Wai Road Playground","Po Lam Road North,  Outside Yuk King House,  King Ming Court",57.0,57.0,0.0,0.0
"Po Lam Road North,  Outside Yuk King House,  King Ming Court",No.65 Ma Tau Chung Road,57.0,57.0,0.0,0.0
No.65 Ma Tau Chung Road,Po Fung Road outside Yan Ming Court,57.0,57.0,0.0,0.0
Po Fung Road outside Yan Ming Court,"Ma Tau Chung Road,  Outside Argyle Street Playground",57.0,57.0,0.0,0.0
"Ma Tau Chung Road,  Outside Argyle Street Playground","Po Lam Road North,  opposite to Po Yan House",57.0,57.0,0.0,0.0
"Po Lam Road North,  opposite to Po Yan House",Po Fung Road outside Verbena Heights,57.0,57.0,0.0,0.0
Po Fung Road outside Verbena Heights,"Prince Edward Road East,  Opposite Kai Tak Government Building",57.0,57.0,0.0,0.0
"Prince Edward Road East,  Opposite Kai Tak Government Building","Po Lam Road North,  Opposite Lok Sin Tong Lau Tak Primary School",57.0,57.0,0.0,0.0
"Po Lam Road North,  Opposite Lok Sin Tong Lau Tak Primary School",Po Hong Road outside Metro City,57.0,57.0,0.0,0.0
Po Hong Road outside Metro City,"Po Fung Road,  outside STFA Leung Kit Wah Primary School",57.0,57.0,0.0,0.0
"Po Fung Road,  outside STFA Leung Kit Wah Primary School","Po Hong Road,  Outside Po Hong Park",57.0,57.0,0.0,0.0
"Po Hong Road,  Outside Po Hong Park","Prince Edward Road East,  outside the Latitude",57.0,57.0,0.0,0.0
"Prince Edward Road East,  outside the Latitude",Po Hong Road near Mobil Petrol Station,57.0,57.0,0.0,0.0
Po Hong Road near Mobil Petrol Station,Prince Edward Road East Opposite Rhythm Garden,57.0,57.0,0.0,0.0
Prince Edward Road East Opposite Rhythm Garden,"Po Hong Road,  Outside Metro City",57.0,57.0,0.0,0.0
"Po Hong Road,  Outside Metro City",Po Fung Road opposite Verbena Heights,57.0,57.0,0.0,0.0
Po Fung Road opposite Verbena Heights,"Prince Edward Road East,  opposite to the Latitude",57.0,57.0,0.0,0.0
"Prince Edward Road East,  opposite to the Latitude","Po Hong Road,  Outside Po Hong Park",57.0,57.0,0.0,0.0
"Po Hong Road,  Outside Po Hong Park","Po Fung Road,  Outside Po Kim House,  Po Lam Estate",57.0,57.0,0.0,0.0
"Po Fung Road,  Outside Po Kim House,  Po Lam Estate",Sung Wong Toi Playground,57.0,57.0,0.0,0.0
Sung Wong Toi Playground,Prince Edward Road East Opposite Rhythm Garden,57.0,57.0,0.0,0.0
Prince Edward Road East Opposite Rhythm Garden,"Ma Tau Chung Road,  Outside Sung Wong Toi Playground",57.0,57.0,0.0,0.0
"Ma Tau Chung Road,  Outside Sung Wong Toi Playground","Prince Edward Road East,  opposite to the Latitude",57.0,57.0,0.0,0.0
"Prince Edward Road East,  opposite to the Latitude","Po Lam Road North,  outside Ying Ming Court",57.0,57.0,0.0,0.0
"Po Lam Road North,  outside Ying Ming Court",Sung Wong Toi Playground,57.0,57.0,0.0,0.0
Sung Wong Toi Playground,"Ma Tau Chung Road,  Outside Fok On Building",57.0,57.0,0.0,0.0
"Ma Tau Chung Road,  Outside Fok On Building",Po Lam Road North outside Po Yan House of Po Lam Estate,57.0,57.0,0.0,0.0
Po Lam Road North outside Po Yan House of Po Lam Estate,"Po Lam Road North,  Outside Po Yan House,  Po Lam Estate",57.0,57.0,0.0,0.0
"Po Lam Road North,  Outside Po Yan House,  Po Lam Estate","Ma Tau Chung Road,  Outside The Hong Kong Federation Of Trade Unions Worker^s Club",57.0,57.0,0.0,0.0
"Ma Tau Chung Road,  Outside The Hong Kong Federation Of Trade Unions Worker^s Club","Ma Tau Chung Road,  Outside Sung Wong Toi Playground",57.0,57.0,0.0,0.0
"Ma Tau Chung Road,  Outside Sung Wong Toi Playground",No.187 Ma Tau Wai Road,57.0,57.0,0.0,0.0
No.187 Ma Tau Wai Road,"Po Lam Road North,  Opposite King Min House,  King Lam Estate",57.0,57.0,0.0,0.0
"Po Lam Road North,  Opposite King Min House,  King Lam Estate","Ma Tau Chung Road,  Outside Fok On Building",57.0,57.0,0.0,0.0
"Ma Tau Chung Road,  Outside Fok On Building","Sheung Heung Road,  No.37",57.0,57.0,0.0,0.0
"Sheung Heung Road,  No.37","Hong Sing Garden Bus Terminus,  Outside King Ling College",57.0,57.0,0.0,0.0
"Hong Sing Garden Bus Terminus,  Outside King Ling College","Ma Tau Chung Road,  Outside The Hong Kong Federation Of Trade Unions Worker^s Club",57.0,57.0,0.0,0.0
"Ma Tau Chung Road,  Outside The Hong Kong Federation Of Trade Unions Worker^s Club",To Kwa Wan Mansion,57.0,57.0,0.0,0.0
To Kwa Wan Mansion,No.187 Ma Tau Wai Road,57.0,57.0,0.0,0.0
No.187 Ma Tau Wai Road,"Sheung Heung Road,  No.37",57.0,57.0,0.0,0.0
"Sheung Heung Road,  No.37",World Wide Industrial Building,57.0,57.0,0.0,0.0
World Wide Industrial Building,To Kwa Wan Mansion,57.0,57.0,0.0,0.0
To Kwa Wan Mansion,"Ko Shan Road,  Outside Ko Shan Theatre",57.0,57.0,0.0,0.0
"Ko Shan Road,  Outside Ko Shan Theatre",World Wide Industrial Building,57.0,57.0,0.0,0.0
World Wide Industrial Building,"Ko Shan Road,  Outside Ko Shan Theatre",114.0,114.0,0.0,0.0
"Po Fung Road,  outside STFA Leung Kit Wah Primary School","Ko Shan Road,  Outside Ko Shan Theatre",57.0,57.0,0.0,0.0
"Ko Shan Road,  Outside Ko Shan Theatre",Po Hong Road outside Metro City,57.0,57.0,0.0,0.0
Po Hong Road outside Metro City,232 Ma Tau Wai Road,57.0,57.0,0.0,0.0
232 Ma Tau Wai Road,"Po Hong Road,  Outside Po Hong Park",57.0,57.0,0.0,0.0
"Po Hong Road,  Outside Po Hong Park",416 Ma Tau Wai Road,57.0,57.0,0.0,0.0
416 Ma Tau Wai Road,Prince Edward Road East Opposite Rhythm Garden,57.0,57.0,0.0,0.0
Prince Edward Road East Opposite Rhythm Garden,"Ma Tau Wai Road,  Outside Ma Tau Wai Road Playground",57.0,57.0,0.0,0.0
